{
  "schema_version": "1.0.0",
  "artifact_type": "20_synthesis",
  "investigation_id": "RQ-0003-v001",
  "rq_id": "RQ-0003",
  "synthesized_at": "2026-09-19T13:39:00+09:00",
  "knowledge_units": [
    {
      "knowledge_unit_id": "K0001",
      "statement": "Draft 2020-12では、ifのvalidation結果に応じてthenまたはelseのsubschemaを条件付きで適用できる。",
      "evidence_refs": [
        "E0001"
      ]
    },
    {
      "knowledge_unit_id": "K0002",
      "statement": "additionalPropertiesは、同一schema objectのproperties / patternPropertiesで評価対象にならなかったpropertyへ適用できる。",
      "evidence_refs": [
        "E0002"
      ]
    },
    {
      "knowledge_unit_id": "K0003",
      "statement": "Research Atelierの30_analysis schema v1はquestion_typeを条件にprofile schemaを選び、各profileをadditionalProperties:falseで閉じる構造を持つ。",
      "evidence_refs": [
        "E0003"
      ]
    },
    {
      "knowledge_unit_id": "K0004",
      "statement": "profile-mismatch fixtureはCausal profileへprediction_targetを混入させるnegative caseを定義しており、Type-specific field混入を検査できる形になっている。",
      "evidence_refs": [
        "E0004"
      ]
    },
    {
      "knowledge_unit_id": "K0005",
      "statement": "JSON Schema validationで保証できるのは定義した構造制約への適合であり、Question Type分類やanalysis内容のdomain-specificな意味論的妥当性までは保証しない。",
      "evidence_refs": [
        "E0005"
      ]
    }
  ],
  "relations": [
    {
      "relation_id": "R0001",
      "relation_type": "dependency",
      "knowledge_unit_refs": [
        "K0001",
        "K0003"
      ],
      "description": "K0003のconditional profile selectionはK0001のif/then semanticsを利用する。",
      "evidence_refs": [
        "E0001",
        "E0003"
      ]
    },
    {
      "relation_id": "R0002",
      "relation_type": "dependency",
      "knowledge_unit_refs": [
        "K0002",
        "K0003"
      ],
      "description": "K0003のprofile closureはK0002のadditionalProperties semanticsを利用する。",
      "evidence_refs": [
        "E0002",
        "E0003"
      ]
    },
    {
      "relation_id": "R0003",
      "relation_type": "dependency",
      "knowledge_unit_refs": [
        "K0003",
        "K0004"
      ],
      "description": "K0004はK0003がType-specific field混入を拒否できるかを試すnegative fixtureである。",
      "evidence_refs": [
        "E0003",
        "E0004"
      ]
    },
    {
      "relation_id": "R0004",
      "relation_type": "qualification",
      "knowledge_unit_refs": [
        "K0003",
        "K0005"
      ],
      "description": "K0003の構造分離はstructural safetyを与えるが、semantic correctnessまでは保証しない。",
      "evidence_refs": [
        "E0003",
        "E0005"
      ]
    }
  ],
  "uncertainties": [
    {
      "uncertainty_id": "U0001",
      "description": "本pilotは1つのMethodological RQと代表negative caseを中心に検証しており、8 Question Typeすべてのprofile field completenessまでは検証していない。",
      "knowledge_unit_refs": [
        "K0003",
        "K0004",
        "K0005"
      ],
      "evidence_refs": [
        "E0003",
        "E0004",
        "E0005"
      ]
    }
  ]
}
